{
  "project": "STD",
  "authority": "STD",
  "document_id": "EX-EXPORT-DESIGN",
  "document_type": "design.system-mechanism",
  "document_version": "3.0.1-draft.1",
  "title": "完整机制教学案例：有副作用的暂存导出",
  "document_owner": "STD Example Maintainer",
  "authors": [
    "STD"
  ],
  "source_repository": "corezilla/STD",
  "source_path": "docs/examples/mechanism-side-effect-example.md",
  "template_id": "design.system-mechanism",
  "template_version": "2.1.0",
  "template_sha256": "145da7449eccaa0ba4e2094b6914fa2674436a28c3e75c1f479425a6a4ac046f",
  "template_conformance": "legacy-mapped",
  "tailoring_ref": null,
  "migration_map_ref": "docs/interface-data-mapping-review.md",
  "design_level": "cross-level",
  "domain": [
    "software"
  ],
  "status": "draft",
  "visibility": "public",
  "reviewed_commit": null,
  "created_at": "2026-09-12",
  "last_modified_at": "2026-09-12",
  "supersedes": null
}
